Page Title,Page URL,Source Type,Section Type,Text Content
Help | Meteorological & Oceanographic Satellite Data Archival Centre,https://www.mosdac.gov.in/help,General,LI,GalleriesSatellite ProductsWeather ForecastOcean ForecastRADAR (DWR)Global Ocean Current
Help | Meteorological & Oceanographic Satellite Data Archival Centre,https://www.mosdac.gov.in/help,General,LI,Data AccessOrder DataOpen DataAtmosphereBayesian based MT-SAPHIR rainfallGPS derived Integrated water vapourGSMap ISRO RainMETEOSAT8 Cloud PropertiesLand3D Volumetric TERLS DWRproductInland Water HeightRiver DischargeSoil MoistureOceanGlobal Ocean Surface CurrentHigh Resolution Sea Surface SalinityIndian Mainland Coastal ProductOcean SubsurfaceOceanic Eddies DetectionSea Ice Occurrence ProbabilityWave based Renewable EnergyCal-ValForecastRSS Feeds
Help | Meteorological & Oceanographic Satellite Data Archival Centre,https://www.mosdac.gov.in/help,General,LI,Open DataAtmosphereBayesian based MT-SAPHIR rainfallGPS derived Integrated water vapourGSMap ISRO RainMETEOSAT8 Cloud PropertiesLand3D Volumetric TERLS DWRproductInland Water HeightRiver DischargeSoil MoistureOceanGlobal Ocean Surface CurrentHigh Resolution Sea Surface SalinityIndian Mainland Coastal ProductOcean SubsurfaceOceanic Eddies DetectionSea Ice Occurrence ProbabilityWave based Renewable Energy
Help | Meteorological & Oceanographic Satellite Data Archival Centre,https://www.mosdac.gov.in/help,General,LI,AtmosphereBayesian based MT-SAPHIR rainfallGPS derived Integrated water vapourGSMap ISRO RainMETEOSAT8 Cloud Properties
Help | Meteorological & Oceanographic Satellite Data Archival Centre,https://www.mosdac.gov.in/help,General,LI,Land3D Volumetric TERLS DWRproductInland Water HeightRiver DischargeSoil Moisture
Help | Meteorological & Oceanographic Satellite Data Archival Centre,https://www.mosdac.gov.in/help,General,LI,OceanGlobal Ocean Surface CurrentHigh Resolution Sea Surface SalinityIndian Mainland Coastal ProductOcean SubsurfaceOceanic Eddies DetectionSea Ice Occurrence ProbabilityWave based Renewable Energy
Help | Meteorological & Oceanographic Satellite Data Archival Centre,https://www.mosdac.gov.in/help,General,LI,Galleries»Satellite ProductsWeather ForecastOcean ForecastRADAR (DWR)Global Ocean Current
Help | Meteorological & Oceanographic Satellite Data Archival Centre,https://www.mosdac.gov.in/help,General,LI,Data Access»Order DataOpen Data»Atmosphere»Bayesian based MT-SAPHIR rainfallGPS derived Integrated water vapourGSMap ISRO RainMETEOSAT8 Cloud PropertiesLand»3D Volumetric TERLS DWRproductInland Water HeightRiver DischargeSoil MoistureOcean»Global Ocean Surface CurrentHigh Resolution Sea Surface SalinityIndian Mainland Coastal ProductOcean SubsurfaceOceanic Eddies DetectionSea Ice Occurrence ProbabilityWave based Renewable EnergyCal-ValForecastRSS Feeds
Help | Meteorological & Oceanographic Satellite Data Archival Centre,https://www.mosdac.gov.in/help,General,LI,Open Data»Atmosphere»Bayesian based MT-SAPHIR rainfallGPS derived Integrated water vapourGSMap ISRO RainMETEOSAT8 Cloud PropertiesLand»3D Volumetric TERLS DWRproductInland Water HeightRiver DischargeSoil MoistureOcean»Global Ocean Surface CurrentHigh Resolution Sea Surface SalinityIndian Mainland Coastal ProductOcean SubsurfaceOceanic Eddies DetectionSea Ice Occurrence ProbabilityWave based Renewable Energy
Help | Meteorological & Oceanographic Satellite Data Archival Centre,https://www.mosdac.gov.in/help,General,LI,Atmosphere»Bayesian based MT-SAPHIR rainfallGPS derived Integrated water vapourGSMap ISRO RainMETEOSAT8 Cloud Properties
Help | Meteorological & Oceanographic Satellite Data Archival Centre,https://www.mosdac.gov.in/help,General,LI,Land»3D Volumetric TERLS DWRproductInland Water HeightRiver DischargeSoil Moisture
Help | Meteorological & Oceanographic Satellite Data Archival Centre,https://www.mosdac.gov.in/help,General,LI,Ocean»Global Ocean Surface CurrentHigh Resolution Sea Surface SalinityIndian Mainland Coastal ProductOcean SubsurfaceOceanic Eddies DetectionSea Ice Occurrence ProbabilityWave based Renewable Energy
Help | Meteorological & Oceanographic Satellite Data Archival Centre,https://www.mosdac.gov.in/help,General,H3,"AccessibilityKnow about the accessibility statement, accessibility features, and accessibility options. We are committed to ensure that the SAC website is accessible to all users irrespective of device in use, technology or ability. It has been built, with an aim,to provide maximum accessibility and usability to its visitors.We have put in our best efforts to ensure that all information on this Portal is accessible to people with disabilities. For example, a user with visual disability can access this Portal using assistive technologies, such as screen readers and magnifiers.We also aim to be standards compliant and follow principles of usability and universal design, which should help all visitors of this Portal.This Portal is designed using XHTML 1.0 Transitional and meets priority 1 (level A) of the Web Content Accessibility Guidelines (WCAG) 2.0 laid down by the World Wide Web Consortium (W3C). Part of the information in the Portal is also made available through links to external Web sites. External Web sites are maintained by the respective departments who are responsible for making these sites accessible."
Help | Meteorological & Oceanographic Satellite Data Archival Centre,https://www.mosdac.gov.in/help,General,P,Following different options are provided in the form of icons which are available on the top of each page:
Help | Meteorological & Oceanographic Satellite Data Archival Centre,https://www.mosdac.gov.in/help,General,P,Allows to increase the text size up to Two levels
Help | Meteorological & Oceanographic Satellite Data Archival Centre,https://www.mosdac.gov.in/help,General,P,Allows to decrease the text size up to Two levels
Help | Meteorological & Oceanographic Satellite Data Archival Centre,https://www.mosdac.gov.in/help,General,P,Allows to set default text size
Help | Meteorological & Oceanographic Satellite Data Archival Centre,https://www.mosdac.gov.in/help,General,P,Changing the color scheme refers to applying a suitable background and text color that ensures clear readability. There are two options provided to change the color scheme. These are:
Help | Meteorological & Oceanographic Satellite Data Archival Centre,https://www.mosdac.gov.in/help,General,P,"Screen Reader AccessProvides information regarding access to different Screen Readers.Space Applications Centre fully complies with Guidelines for Indian Government Websites (link is external). Our visitors with visual impairments can access the Portal using Assistive Technologies, such as screen readers.The information of the Portal is accessible with different screen readers, such as JAWS, NVDA, SAFA, Supernova and Window-Eyes.Following table lists the information about different screen readers:"
Help | Meteorological & Oceanographic Satellite Data Archival Centre,https://www.mosdac.gov.in/help,General,P,"Website owned and maintained by MOSDAC, Space Applications Centre, Indian Space Research Organisation, Govt. of INDIA."
Help | Meteorological & Oceanographic Satellite Data Archival Centre,https://www.mosdac.gov.in/help,General,P,"""Ver 3.0; Last reviewed and updated on
01 Jul, 2025& Served By:
Web-Srv-Pri"
